<?xml version='1.0' encoding='UTF-8'?>
<ChineseNameDatabase xmlns="https://6wimu.github.io/615_ChineseName_Schema/" xmlns:dcterms="http://purl.org/dc/terms/" xmlns:xsi="http://www.w3.org/2001/XMLSchema-instance" xsi:schemaLocation="https://6wimu.github.io/615_ChineseName_Schema/ cn_schema.xsd">
  <NameRecord>
    <dcterms:identifier>CN-2026-0007</dcterms:identifier>
    <originalName>박다운</originalName>
    <inLanguage>Korean</inLanguage>
    <familyName>朴</familyName>
    <givenName>多韵</givenName>
    <fullChineseName>朴多韵</fullChineseName>
    <pinyin>Piáo Duōyùn</pinyin>
    <ipa>[pʰjɑʊ̯˧˥ twɔ˥ yn˥˩]</ipa>
    <nationality>KR</nationality>
    <mappingType>Phono-Semantic</mappingType>
    <dcterms:description>The Korean name is mapped through similar sounds while selecting characters with positive meanings: 多 suggests abundance, and 韵 suggests grace, rhythm, and artistic charm.</dcterms:description>
    <hanziRadical>夕</hanziRadical>
    <hanziRadical>音</hanziRadical>
    <pronunciationDifficulty>Medium</pronunciationDifficulty>
    <culturalElement>None</culturalElement>
  </NameRecord>
</ChineseNameDatabase>
