<?xml version='1.0' encoding='UTF-8'?>
<ChineseNameDatabase xmlns="https://6wimu.github.io/615_ChineseName_Schema/" xmlns:dcterms="http://purl.org/dc/terms/" xmlns:xsi="http://www.w3.org/2001/XMLSchema-instance" xsi:schemaLocation="https://6wimu.github.io/615_ChineseName_Schema/ cn_schema.xsd">
  <NameRecord>
    <dcterms:identifier>CN-2026-0002</dcterms:identifier>
    <originalName>David</originalName>
    <inLanguage>English</inLanguage>
    <familyName>戴</familyName>
    <givenName>伟</givenName>
    <fullChineseName>戴伟</fullChineseName>
    <pinyin>Dài Wěi</pinyin>
    <ipa>[taɪ̯˥˩ weɪ̯˨˩˦]</ipa>
    <nationality>US</nationality>
    <mappingType>Localization</mappingType>
    <dcterms:description>The opening sound of “David” is localized through the established Chinese surname 戴. The given name 伟 conveys greatness and distinction.</dcterms:description>
    <hanziRadical>亻</hanziRadical>
    <pronunciationDifficulty>Low</pronunciationDifficulty>
    <culturalElement>None</culturalElement>
  </NameRecord>
  <NameRecord>
    <dcterms:identifier>CN-2026-0007</dcterms:identifier>
    <originalName>박다운</originalName>
    <inLanguage>Korean</inLanguage>
    <familyName>朴</familyName>
    <givenName>多韵</givenName>
    <fullChineseName>朴多韵</fullChineseName>
    <pinyin>Piáo Duōyùn</pinyin>
    <ipa>[pʰjɑʊ̯˧˥ twɔ˥ yn˥˩]</ipa>
    <nationality>KR</nationality>
    <mappingType>Phono-Semantic</mappingType>
    <dcterms:description>The Korean name is mapped through similar sounds while selecting characters with positive meanings: 多 suggests abundance, and 韵 suggests grace, rhythm, and artistic charm.</dcterms:description>
    <hanziRadical>夕</hanziRadical>
    <hanziRadical>音</hanziRadical>
    <pronunciationDifficulty>Medium</pronunciationDifficulty>
    <culturalElement>None</culturalElement>
  </NameRecord>
  <NameRecord>
    <dcterms:identifier>CN-2026-0011</dcterms:identifier>
    <originalName>Victor</originalName>
    <inLanguage>English</inLanguage>
    <givenName>胜伟</givenName>
    <fullChineseName>胜伟</fullChineseName>
    <pinyin>Shèng Wěi</pinyin>
    <ipa>[ʂɤŋ˥˩ weɪ̯˨˩˦]</ipa>
    <nationality>CA</nationality>
    <mappingType>Semantic</mappingType>
    <dcterms:description>Victor is represented semantically rather than forced into a surname–given-name structure. 胜 conveys victory, while 伟 adds the idea of greatness; familyName is intentionally omitted.</dcterms:description>
    <hanziRadical>月</hanziRadical>
    <hanziRadical>亻</hanziRadical>
    <pronunciationDifficulty>Medium</pronunciationDifficulty>
    <culturalElement>None</culturalElement>
  </NameRecord>
  <NameRecord>
    <dcterms:identifier>CN-2026-0014</dcterms:identifier>
    <originalName>Sofia</originalName>
    <inLanguage>English</inLanguage>
    <givenName>索菲娅</givenName>
    <fullChineseName>索菲娅</fullChineseName>
    <pinyin>Suǒ Fēiyà</pinyin>
    <ipa>[swɔ˨˩˦ feɪ̯˥ ja˥˩]</ipa>
    <nationality>ES</nationality>
    <mappingType>Phonetic</mappingType>
    <dcterms:description>The syllables of Sofia are rendered phonetically as 索菲娅. Because this is a transliteration rather than a conventional Chinese surname and given name, familyName is intentionally omitted.</dcterms:description>
    <hanziRadical>糸</hanziRadical>
    <hanziRadical>艹</hanziRadical>
    <hanziRadical>女</hanziRadical>
    <pronunciationDifficulty>Medium</pronunciationDifficulty>
    <culturalElement>None</culturalElement>
  </NameRecord>
  <NameRecord>
    <dcterms:identifier>CN-2026-0018</dcterms:identifier>
    <originalName>Wilson</originalName>
    <inLanguage>English</inLanguage>
    <familyName>韦</familyName>
    <givenName>炜森</givenName>
    <fullChineseName>韦炜森</fullChineseName>
    <pinyin>Wéi Wěisēn</pinyin>
    <ipa>[weɪ̯˧˥ weɪ̯˨˩˦ sən˥]</ipa>
    <nationality>GB</nationality>
    <mappingType>Phono-Semantic</mappingType>
    <dcterms:description>韦 approximates the opening sound of Wilson. 炜 conveys brilliance and carries the fire radical, while 森 evokes a flourishing forest and carries the wood radical; the recommendation records a Five Elements consideration.</dcterms:description>
    <hanziRadical>火</hanziRadical>
    <hanziRadical>木</hanziRadical>
    <pronunciationDifficulty>Medium</pronunciationDifficulty>
    <culturalElement>FiveElements</culturalElement>
  </NameRecord>
  <NameRecord>
    <dcterms:identifier>CN-2026-0021</dcterms:identifier>
    <originalName>はるか (Haruka)</originalName>
    <inLanguage>Japanese</inLanguage>
    <givenName>春香</givenName>
    <fullChineseName>春香</fullChineseName>
    <pinyin>Chūnxiāng</pinyin>
    <ipa>[ʈʂʰwən˥ ɕjɑŋ˥]</ipa>
    <nationality>JP</nationality>
    <mappingType>HanjaSphere</mappingType>
    <dcterms:description>The Japanese given name はるか can be written as 春香. This sample preserves the Han-character form across the East Asian character sphere and records its Mandarin reading as Chūnxiāng.</dcterms:description>
    <hanziRadical>日</hanziRadical>
    <hanziRadical>香</hanziRadical>
    <pronunciationDifficulty>High</pronunciationDifficulty>
    <culturalElement>None</culturalElement>
  </NameRecord>
</ChineseNameDatabase>
