<?xml version='1.0' encoding='UTF-8'?>
<ChineseNameDatabase xmlns="https://6wimu.github.io/615_ChineseName_Schema/" xmlns:dcterms="http://purl.org/dc/terms/" xmlns:xsi="http://www.w3.org/2001/XMLSchema-instance" xsi:schemaLocation="https://6wimu.github.io/615_ChineseName_Schema/ cn_schema.xsd">
  <NameRecord>
    <dcterms:identifier>CN-2026-0002</dcterms:identifier>
    <originalName>David</originalName>
    <inLanguage>English</inLanguage>
    <familyName>戴</familyName>
    <givenName>伟</givenName>
    <fullChineseName>戴伟</fullChineseName>
    <pinyin>Dài Wěi</pinyin>
    <ipa>[taɪ̯˥˩ weɪ̯˨˩˦]</ipa>
    <nationality>US</nationality>
    <mappingType>Localization</mappingType>
    <dcterms:description>The opening sound of “David” is localized through the established Chinese surname 戴. The given name 伟 conveys greatness and distinction.</dcterms:description>
    <hanziRadical>亻</hanziRadical>
    <pronunciationDifficulty>Low</pronunciationDifficulty>
    <culturalElement>None</culturalElement>
  </NameRecord>
</ChineseNameDatabase>
