<?xml version='1.0' encoding='UTF-8'?>
<ChineseNameDatabase xmlns="https://6wimu.github.io/615_ChineseName_Schema/" xmlns:dcterms="http://purl.org/dc/terms/" xmlns:xsi="http://www.w3.org/2001/XMLSchema-instance" xsi:schemaLocation="https://6wimu.github.io/615_ChineseName_Schema/ cn_schema.xsd">
  <NameRecord>
    <dcterms:identifier>CN-2026-0011</dcterms:identifier>
    <originalName>Victor</originalName>
    <inLanguage>English</inLanguage>
    <givenName>ŤÉúšľü</givenName>
    <fullChineseName>ŤÉúšľü</fullChineseName>
    <pinyin>Sh√®ng Wńõi</pinyin>
    <ipa>[ ā…§Ňčň•ň© we…™ŐĮň®ň©ň¶]</ipa>
    <nationality>CA</nationality>
    <mappingType>Semantic</mappingType>
    <dcterms:description>Victor is represented semantically rather than forced into a surname‚Äďgiven-name structure. ŤÉú conveys victory, while šľü adds the idea of greatness; familyName is intentionally omitted.</dcterms:description>
    <hanziRadical>śúą</hanziRadical>
    <hanziRadical>šļĽ</hanziRadical>
    <pronunciationDifficulty>Medium</pronunciationDifficulty>
    <culturalElement>None</culturalElement>
  </NameRecord>
</ChineseNameDatabase>
