<?xml version='1.0' encoding='UTF-8'?>
<ChineseNameDatabase xmlns="https://6wimu.github.io/615_ChineseName_Schema/" xmlns:dcterms="http://purl.org/dc/terms/" xmlns:xsi="http://www.w3.org/2001/XMLSchema-instance" xsi:schemaLocation="https://6wimu.github.io/615_ChineseName_Schema/ cn_schema.xsd">
  <NameRecord>
    <dcterms:identifier>CN-2026-0018</dcterms:identifier>
    <originalName>Wilson</originalName>
    <inLanguage>English</inLanguage>
    <familyName>ťü¶</familyName>
    <givenName>Áāúś£ģ</givenName>
    <fullChineseName>ťü¶Áāúś£ģ</fullChineseName>
    <pinyin>W√©i Wńõisńďn</pinyin>
    <ipa>[we…™ŐĮňßň• we…™ŐĮň®ň©ň¶ s…ônň•]</ipa>
    <nationality>GB</nationality>
    <mappingType>Phono-Semantic</mappingType>
    <dcterms:description>ťü¶ approximates the opening sound of Wilson. Áāú conveys brilliance and carries the fire radical, while ś£ģ evokes a flourishing forest and carries the wood radical; the recommendation records a Five Elements consideration.</dcterms:description>
    <hanziRadical>ÁĀę</hanziRadical>
    <hanziRadical>śú®</hanziRadical>
    <pronunciationDifficulty>Medium</pronunciationDifficulty>
    <culturalElement>FiveElements</culturalElement>
  </NameRecord>
</ChineseNameDatabase>
