<?xml version='1.0' encoding='UTF-8'?>
<ChineseNameDatabase xmlns="https://6wimu.github.io/615_ChineseName_Schema/" xmlns:dcterms="http://purl.org/dc/terms/" xmlns:xsi="http://www.w3.org/2001/XMLSchema-instance" xsi:schemaLocation="https://6wimu.github.io/615_ChineseName_Schema/ cn_schema.xsd">
  <NameRecord>
    <dcterms:identifier>CN-2026-0021</dcterms:identifier>
    <originalName>„ĀĮ„āč„Āč (Haruka)</originalName>
    <inLanguage>Japanese</inLanguage>
    <givenName>śė•ť¶ô</givenName>
    <fullChineseName>śė•ť¶ô</fullChineseName>
    <pinyin>ChŇęnxińĀng</pinyin>
    <ipa>[ ą ā įw…ônň• …ēj…ĎŇčň•]</ipa>
    <nationality>JP</nationality>
    <mappingType>HanjaSphere</mappingType>
    <dcterms:description>The Japanese given name „ĀĮ„āč„Āč can be written as śė•ť¶ô. This sample preserves the Han-character form across the East Asian character sphere and records its Mandarin reading as ChŇęnxińĀng.</dcterms:description>
    <hanziRadical>śó•</hanziRadical>
    <hanziRadical>ť¶ô</hanziRadical>
    <pronunciationDifficulty>High</pronunciationDifficulty>
    <culturalElement>None</culturalElement>
  </NameRecord>
</ChineseNameDatabase>
